{
  "$schema": "http://json-schema.org/draft/2020-12/schema",
  "type": "object",
  "title": "Homebrew-based Fleet-maintained apps input schema",
  "description": "Specify metadata to source a Fleet-maintained app from Homebrew.",
  "required": [
    "name",
    "unique_identifier",
    "token",
    "installer_format",
    "slug",
    "default_categories"
  ],
  "properties": {
    "name": {
      "type": "string",
      "description": "The user-facing name of the application.",
      "minLength": 1
    },
    "unique_identifier": {
      "type": "string",
      "description": "The platform-specific unique identifier for the app. On macOS, this is the app's bundle identifier.",
      "minLength": 1
    },
    "token": {
      "type": "string",
      "description": "The identifier used by homebrew for the app; it is the token field on the homebrew API response.",
      "minLength": 1
    },
    "installer_format": {
      "type": "string",
      "description": "The file format for the app's installer.",
      "enum": ["zip", "dmg", "pkg"]
    },
    "slug": {
      "type": "string",
      "description": "The slug identifies a specific app and platform combination. It is used to name the manifest files that contain the metadata that Fleet needs to add, install, and uninstall this app. Format: app-name/platform (e.g., adobe-acrobat-reader/darwin)",
      "pattern": "^[a-z0-9-+@]+/darwin$",
      "minLength": 1
    },
    "pre_uninstall_scripts": {
      "type": "array",
      "description": "Command lines that will be run before the generated uninstall script is executed.",
      "items": {
        "type": "string",
        "minLength": 1
      }
    },
    "post_uninstall_scripts": {
      "type": "array",
      "description": "Command lines that will be run after the generated uninstall script is executed.",
      "items": {
        "type": "string",
        "minLength": 1
      }
    },
    "default_categories": {
      "type": "array",
      "description": "The default categories assigned to the installer in self-service if no categories are specified when it is added to a team's library.",
      "items": {
        "type": "string",
        "enum": ["Browsers", "Communication", "Developer tools", "Productivity", "Security", "Utilities"]
      },
      "minItems": 1,
      "uniqueItems": true
    },
    "install_script_path": {
      "type": "string",
      "description": "A filepath to an install script. If provided, this script will override the generated install script.",
      "minLength": 1,
      "pattern": "\\.sh$"
    },
    "uninstall_script_path": {
      "type": "string",
      "description": "A filepath to an uninstall script. If provided, this script will override the generated uninstall script.",
      "minLength": 1,
      "pattern": "\\.sh$"
    },
    "frozen": {
      "type": "boolean",
      "description": "If true, the app will not be processed during ingestion and no new output will be created."
    },
    "cask_path": {
      "type": "string",
      "description": "Path (relative to the repo root) to a local file containing the cask JSON in the same schema as https://formulae.brew.sh/api/cask/<token>.json. Used to commit cask metadata for third-party taps directly into this repo under inputs/homebrew/custom-tap/.",
      "minLength": 1,
      "pattern": "\\.json$"
    },
    "signature": {
      "type": "object",
      "description": "Pinned signing identity for the app's installer, verified at ingest (cmd/maintained-apps/verify) and in the validator before the install script runs. Pin the Developer ID Team ID (it survives certificate renewals); an identity change fails verification and requires a reviewed pin update.",
      "properties": {
        "apple_team_id": {
          "type": "string",
          "description": "The Apple Developer ID Team ID expected to have signed the installer (e.g. \"M683GB7CPW\").",
          "pattern": "^[A-Z0-9]{10}$"
        },
        "notarized": {
          "type": "boolean",
          "description": "Whether the installer is expected to carry an Apple notarization ticket."
        },
        "unsigned": {
          "type": "boolean",
          "description": "Acknowledges that the vendor ships an unsigned installer. Requires a justification and is mutually exclusive with the identity pins."
        },
        "justification": {
          "type": "string",
          "description": "Why an unsigned installer is acceptable for this app. Required when unsigned is true.",
          "minLength": 1
        }
      },
      "if": {
        "properties": { "unsigned": { "const": true } },
        "required": ["unsigned"]
      },
      "then": {
        "required": ["justification"],
        "not": {
          "anyOf": [
            { "required": ["apple_team_id"] },
            { "properties": { "notarized": { "const": true } }, "required": ["notarized"] }
          ]
        }
      },
      "else": {
        "required": ["apple_team_id"]
      },
      "additionalProperties": false
    }
  },
  "not": {
    "allOf": [
      {
        "properties": {
          "uninstall_script_path": {
            "type": "string"
          }
        },
        "required": ["uninstall_script_path"]
      },
      {
        "anyOf": [
          {
            "properties": {
              "pre_uninstall_scripts": {
                "type": "array"
              }
            },
            "required": ["pre_uninstall_scripts"]
          },
          {
            "properties": {
              "post_uninstall_scripts": {
                "type": "array"
              }
            },
            "required": ["post_uninstall_scripts"]
          }
        ]
      }
    ]
  },
  "additionalProperties": false
}
