{
  "name": "Microsoft Azure Storage Explorer",
  "unique_identifier": "com.microsoft.StorageExplorer",
  "token": "microsoft-azure-storage-explorer",
  "installer_format": "zip",
  "slug": "microsoft-azure-storage-explorer/darwin",
  "frozen": true,
  "default_categories": [
    "Productivity"
  ]
}