{
  "name": "QGIS",
  "slug": "qgis/darwin",
  "unique_identifier": "org.qgis.qgis3",
  "token": "qgis",
  "installer_format": "dmg",
  "install_script_path": "ee/maintained-apps/inputs/homebrew/scripts/qgis-install.sh",
  "uninstall_script_path": "ee/maintained-apps/inputs/homebrew/scripts/qgis-uninstall.sh",
  "default_categories": ["Productivity"]
}
